{
  "mission_id": "MSN-20260703T215701Z-3014",
  "title": "[manual_note] Repo has substrate/ built last session but no phone-native s",
  "objective": "Assess whether ForgeWorld's own repo can demonstrate offline phone->laptop continuity",
  "origin": "phone",
  "source_context": {
    "channel": "manual_note",
    "capture_id": "PSM-20260703T215640Z-1840",
    "raw_text": "Repo has substrate/ built last session but no phone-native sensor mission object yet | context: Continuity Substrate Ascension V1 directive, module 01",
    "captured_at": "2026-07-03T21:56:40Z"
  },
  "evidence": [
    {
      "evidence_id": "EVD-20260703T215701Z-3388",
      "description": "Promoted from sensor mission PSM-20260703T215640Z-1840: This directive text + prior substrate/README.md",
      "ref": "PSM-20260703T215640Z-1840",
      "captured_at": "2026-07-03T21:56:40Z"
    }
  ],
  "constraints": [],
  "acceptance_criteria": [],
  "current_state": "complete",
  "artifacts_created": [
    {
      "asset_id": "AST-20260703T220227Z-2824",
      "type": "code",
      "description": "Ascension modules 01-10: sensor-capture.sh, promote-sensor-mission.sh, build-evidence-package.sh, update-capability-genome.sh, update-relationship-graph.sh, export-desktop-packet.sh, governance-check.sh, instrumentation.sh, extended substrate-status.sh",
      "path": "substrate/scripts/"
    }
  ],
  "decisions_made": [],
  "validation_results": [
    {
      "validation_id": "VAL-20260703T220227Z-5010",
      "method": "end-to-end-dry-run",
      "result": "sensor-capture -> promote -> evidence package -> capability genome -> relationship graph -> desktop export manifest all ran successfully against this mission's own data; duplicate detection and deterministic export both verified",
      "validated_at": "2026-07-03T22:02:27Z"
    },
    {
      "validation_id": "VAL-2026-07-03T22:02:28Z",
      "method": "primary-law-check",
      "result": "pass",
      "validated_at": "2026-07-03T22:02:28Z"
    }
  ],
  "commercial_opportunities": [
    {
      "commercial_id": "COM-20260703T220227Z-3256",
      "who_benefits": "ForgeWorld operators running phone+laptop together",
      "problem_solved": "Phone captures were previously ad hoc text; there was no schema-validated, governed, offline-first sensor object feeding the same continuity substrate as the laptop",
      "sellable": true,
      "packaging_form": "software_feature",
      "notes": "This ascension layer is itself the productized capability: phone-native mission capture with governance, evidence packaging, and deterministic sync, sellable as a feature of the ForgeWorld substrate product"
    }
  ],
  "lessons_learned": [
    "A read-only export step must never mutate the very files it hashes - discovered this by testing determinism twice in a row and catching a self-referential hash drift bug before it shipped",
    "Bash array expansion under 'set -u' silently produces a stray empty-string element ([''] instead of []) unless filtered - caught by testing capability genome merges twice, not by reading the code"
  ],
  "next_recommended_action": "Wire promote-sensor-mission.sh + build-evidence-package.sh + update-capability-genome.sh into a single guided phone-to-laptop sync command so an operator doesn't have to run 4 scripts by hand",
  "links": {
    "predecessor_missions": [],
    "successor_missions": []
  },
  "created_at": "2026-07-03T21:57:01Z",
  "updated_at": "2026-07-03T22:02:28Z"
}
