{
  "mission_id": "MSN-20260703T214356Z-0253",
  "title": "[social] LinkedIn comment: 3 people asked if the FORGE lifecycle (Obs",
  "objective": "Turn field capture CAP-20260703T214356Z-0122 into reusable substrate capability.",
  "origin": "phone",
  "source_context": {
    "channel": "social",
    "capture_id": "CAP-20260703T214356Z-0122",
    "raw_text": "LinkedIn comment: 3 people asked if the FORGE lifecycle (Observe->...->Improve) could be sold as a consulting diagnostic for solo founders drowning in scattered notes.",
    "captured_at": "2026-07-03T21:43:56Z"
  },
  "evidence": [
    {
      "evidence_id": "EVD-20260703T214356Z-0769",
      "description": "Original field capture (social): LinkedIn comment: 3 people asked if the FORGE lifecycle (Observe->...->Improve) could be sold as a consulting diagnostic for solo founders drowning in scattered notes.",
      "ref": "CAP-20260703T214356Z-0122",
      "captured_at": "2026-07-03T21:43:56Z"
    }
  ],
  "constraints": [
    "Must not require the founder to install anything; markdown + a short questionnaire only"
  ],
  "acceptance_criteria": [
    "A named lifecycle diagnostic exists that a solo founder can self-score in under 10 minutes"
  ],
  "current_state": "complete",
  "artifacts_created": [
    {
      "asset_id": "AST-20260703T214416Z-9288",
      "type": "template",
      "description": "Lifecycle Continuity Diagnostic: 12-question self-score template mapping a founder's current habits to the Observe->Improve loop, with a weak-link recommendation",
      "path": "substrate/registries/../missions/MSN-20260703T214356Z-0253/artifacts/lifecycle-diagnostic-template.md"
    },
    {
      "asset_id": "AST-20260703T214416Z-4232",
      "type": "workflow",
      "description": "Diagnostic delivery workflow: capture -> score -> weak-link report -> optional consulting upsell",
      "path": ""
    }
  ],
  "decisions_made": [
    {
      "decision_id": "DEC-20260703T214416Z-8750",
      "intent": "Package the Observe->Improve loop as a standalone scored diagnostic instead of a bespoke consulting engagement",
      "evidence": "3 independent LinkedIn commenters asked for a self-check version of the loop, not a custom engagement",
      "reasoning": "A repeatable scored diagnostic is far cheaper to deliver than 1:1 consulting and doubles as a lead magnet into paid consulting",
      "constraints": "",
      "alternatives_considered": "Considered a live workshop format; rejected due to scheduling overhead for a first test",
      "validation": "",
      "outcome": "Approved: build a 12-question lifecycle diagnostic template",
      "lesson_learned": "Signal from 3+ people asking the same question is strong enough to prototype before a fourth request arrives"
    }
  ],
  "validation_results": [
    {
      "validation_id": "VAL-20260703T214416Z-3551",
      "method": "dry-run",
      "result": "Scored the diagnostic against this repo itself: weakest link was 'Govern' (no reviewable decision log existed before this mission) - matches observed reality, template is discriminating correctly",
      "validated_at": "2026-07-03T21:44:16Z"
    },
    {
      "validation_id": "VAL-2026-07-03T21:44:17Z",
      "method": "primary-law-check",
      "result": "pass",
      "validated_at": "2026-07-03T21:44:17Z"
    }
  ],
  "commercial_opportunities": [
    {
      "commercial_id": "COM-20260703T214417Z-8494",
      "who_benefits": "Solo founders and small teams with scattered notes/ideas across phone and laptop",
      "problem_solved": "No structured way to turn a captured idea into reusable organizational capability; ideas get lost between phone and laptop",
      "sellable": true,
      "packaging_form": "diagnostic",
      "notes": "Free 12-question diagnostic as lead magnet; paid tier turns diagnostic output into a configured ForgeWorld mission package for their own stack"
    }
  ],
  "lessons_learned": [
    "A single strong repeated market signal (3 asks) is enough evidence to justify a first prototype, without waiting for more",
    "Packaging our own internal lifecycle as an external diagnostic is a zero-marginal-cost way to validate the substrate's commercial value"
  ],
  "next_recommended_action": "Draft the actual 12 questions for lifecycle-diagnostic-template.md and pilot it on 2 real solo-founder contacts before publishing publicly",
  "links": {
    "predecessor_missions": [],
    "successor_missions": []
  },
  "created_at": "2026-07-03T21:43:56Z",
  "updated_at": "2026-07-03T21:44:17Z"
}
